{
  "$schema": "../schemas/setup-reconcile-vectors.schema.json",
  "$comment": "Generated by node contract/tools/generate.mjs. Edit contract/tools, not these files.",
  "family": "setup-reconcile",
  "contract": 3,
  "section": "9.5",
  "reference": "tools/setup-sync.mjs",
  "notes": [
    "decide: local is {hash, id, lineage} or null; status is the status reply with only contract and controller {hash, id}; metaByHash maps a hash to the config meta answer or refusal current filed for it. expect is the hash a fetch must produce, null for every other decision.",
    "admit: expected is what the decision was made from; currentLocalHash is the applied hash read again from storage after the read; fetched is the canonical hash of the bytes, the hash the reply carried, and the id and lineage of the bytes' own controller block; accepted is section 9.7 under peer intake. Checked in the order headMoved, moved, unverifiable, invalid, inconsistent, adopt.",
    "admit: a config reply without a hash never reaches admit. Section 9.5 never adopts it; the client counts it as a failed request (the 60 s back-off) before admitting anything, so replyHash is always a hash and admit does not test for its absence.",
    "gate: times are integer milliseconds on one clock. failedAt and held are keyed by the applied hash; settled holds \"<applied hash> <remote hash> <agentVersion>\" for each remembered admission refusal. The back-off is 60000 ms: a failure exactly 60000 ms ago no longer holds.",
    "pushReply: reply is the parsed config set reply, or null when none was read. metaHash is set only for fileMeta."
  ],
  "groups": {
    "decide": [
      {
        "name": "unsupported-2x-agent",
        "purpose": "A 2.x agent sends no contract. It cannot carry the setup and is left out, never shown as a conflict.",
        "consumers": [
          "mac",
          "desktop",
          "android"
        ],
        "tags": [],
        "input": {
          "local": {
            "hash": "8ff6bb0ca2b4248f2aa643f273d40bb28444bad5d83419e8310a299fb22cf0d6",
            "id": "setup-3f9c2a71-8d04-4e6b-9a53-7c21b0e5d846",
            "lineage": [
              "fabc292bbd2602712eb30d2edc070e03e0e239e78bd9b47635027238c18d2b57",
              "90d9a39c49b3377b046e7c3e21939423e168f022114b1712f72f8f2c823368a3"
            ]
          },
          "status": {
            "contract": null,
            "controller": {
              "hash": "fabc292bbd2602712eb30d2edc070e03e0e239e78bd9b47635027238c18d2b57",
              "id": null
            }
          },
          "metaByHash": {}
        },
        "expect": {
          "decision": "unsupported",
          "reason": null,
          "expect": null
        }
      },
      {
        "name": "unsupported-no-controller",
        "purpose": "A contract 3 status without a controller block says nothing about the setup, so the machine is left out of this round.",
        "consumers": [
          "mac",
          "desktop",
          "android"
        ],
        "tags": [],
        "input": {
          "local": {
            "hash": "8ff6bb0ca2b4248f2aa643f273d40bb28444bad5d83419e8310a299fb22cf0d6",
            "id": "setup-3f9c2a71-8d04-4e6b-9a53-7c21b0e5d846",
            "lineage": [
              "fabc292bbd2602712eb30d2edc070e03e0e239e78bd9b47635027238c18d2b57",
              "90d9a39c49b3377b046e7c3e21939423e168f022114b1712f72f8f2c823368a3"
            ]
          },
          "status": {
            "contract": 3,
            "controller": null
          },
          "metaByHash": {}
        },
        "expect": {
          "decision": "unsupported",
          "reason": null,
          "expect": null
        }
      },
      {
        "name": "unknown-no-local",
        "purpose": "This device applies no setup yet. Nothing is pushed or fetched automatically; enrolment is an explicit flow.",
        "consumers": [
          "mac",
          "desktop",
          "android"
        ],
        "tags": [],
        "input": {
          "local": null,
          "status": {
            "contract": 3,
            "controller": {
              "hash": "5621668213f02bdb472a15278ae4f044bf14b439e623858ff6f666b672ba284a",
              "id": "setup-3f9c2a71-8d04-4e6b-9a53-7c21b0e5d846"
            }
          },
          "metaByHash": {}
        },
        "expect": {
          "decision": "unknown",
          "reason": "no-local",
          "expect": null
        }
      },
      {
        "name": "unknown-local-unidentified",
        "purpose": "A document without a setup id gets an identity before it takes part, so until then rule 3 keeps it out.",
        "consumers": [
          "mac",
          "desktop",
          "android"
        ],
        "tags": [],
        "input": {
          "local": {
            "hash": "8ff6bb0ca2b4248f2aa643f273d40bb28444bad5d83419e8310a299fb22cf0d6",
            "id": null,
            "lineage": []
          },
          "status": {
            "contract": 3,
            "controller": {
              "hash": "5621668213f02bdb472a15278ae4f044bf14b439e623858ff6f666b672ba284a",
              "id": "setup-3f9c2a71-8d04-4e6b-9a53-7c21b0e5d846"
            }
          },
          "metaByHash": {}
        },
        "expect": {
          "decision": "unknown",
          "reason": "local-unidentified",
          "expect": null
        }
      },
      {
        "name": "push-machine-empty",
        "purpose": "The machine holds nothing: push.",
        "consumers": [
          "mac",
          "desktop",
          "android"
        ],
        "tags": [],
        "input": {
          "local": {
            "hash": "8ff6bb0ca2b4248f2aa643f273d40bb28444bad5d83419e8310a299fb22cf0d6",
            "id": "setup-3f9c2a71-8d04-4e6b-9a53-7c21b0e5d846",
            "lineage": [
              "fabc292bbd2602712eb30d2edc070e03e0e239e78bd9b47635027238c18d2b57",
              "90d9a39c49b3377b046e7c3e21939423e168f022114b1712f72f8f2c823368a3"
            ]
          },
          "status": {
            "contract": 3,
            "controller": {
              "hash": null,
              "id": null
            }
          },
          "metaByHash": {}
        },
        "expect": {
          "decision": "push",
          "reason": "machine-empty",
          "expect": null
        }
      },
      {
        "name": "in-sync",
        "purpose": "The machine holds exactly the applied document.",
        "consumers": [
          "mac",
          "desktop",
          "android"
        ],
        "tags": [],
        "input": {
          "local": {
            "hash": "8ff6bb0ca2b4248f2aa643f273d40bb28444bad5d83419e8310a299fb22cf0d6",
            "id": "setup-3f9c2a71-8d04-4e6b-9a53-7c21b0e5d846",
            "lineage": [
              "fabc292bbd2602712eb30d2edc070e03e0e239e78bd9b47635027238c18d2b57",
              "90d9a39c49b3377b046e7c3e21939423e168f022114b1712f72f8f2c823368a3"
            ]
          },
          "status": {
            "contract": 3,
            "controller": {
              "hash": "8ff6bb0ca2b4248f2aa643f273d40bb28444bad5d83419e8310a299fb22cf0d6",
              "id": "setup-3f9c2a71-8d04-4e6b-9a53-7c21b0e5d846"
            }
          },
          "metaByHash": {}
        },
        "expect": {
          "decision": "inSync",
          "reason": null,
          "expect": null
        }
      },
      {
        "name": "push-machine-unidentified",
        "purpose": "The machine holds a copy nobody claims, pushed without an identity: push over it.",
        "consumers": [
          "mac",
          "desktop",
          "android"
        ],
        "tags": [],
        "input": {
          "local": {
            "hash": "8ff6bb0ca2b4248f2aa643f273d40bb28444bad5d83419e8310a299fb22cf0d6",
            "id": "setup-3f9c2a71-8d04-4e6b-9a53-7c21b0e5d846",
            "lineage": [
              "fabc292bbd2602712eb30d2edc070e03e0e239e78bd9b47635027238c18d2b57",
              "90d9a39c49b3377b046e7c3e21939423e168f022114b1712f72f8f2c823368a3"
            ]
          },
          "status": {
            "contract": 3,
            "controller": {
              "hash": "2cc9e9dd375d8e6221909bd533e1b172bdaf451d920057c17d0cc9e17a9f76d4",
              "id": null
            }
          },
          "metaByHash": {}
        },
        "expect": {
          "decision": "push",
          "reason": "machine-unidentified",
          "expect": null
        }
      },
      {
        "name": "different-setup-even-if-in-lineage",
        "purpose": "Another setup id wins over a hash this device has seen before: rule 7 comes before rule 8, so a person decides instead of a push replacing somebody else's fleet.",
        "consumers": [
          "mac",
          "desktop",
          "android"
        ],
        "tags": [],
        "input": {
          "local": {
            "hash": "8ff6bb0ca2b4248f2aa643f273d40bb28444bad5d83419e8310a299fb22cf0d6",
            "id": "setup-3f9c2a71-8d04-4e6b-9a53-7c21b0e5d846",
            "lineage": [
              "fabc292bbd2602712eb30d2edc070e03e0e239e78bd9b47635027238c18d2b57",
              "90d9a39c49b3377b046e7c3e21939423e168f022114b1712f72f8f2c823368a3"
            ]
          },
          "status": {
            "contract": 3,
            "controller": {
              "hash": "fabc292bbd2602712eb30d2edc070e03e0e239e78bd9b47635027238c18d2b57",
              "id": "setup-8b04d193-6c27-4a51-83ef-90b7d2c46e15"
            }
          },
          "metaByHash": {}
        },
        "expect": {
          "decision": "differentSetup",
          "reason": null,
          "expect": null
        }
      },
      {
        "name": "push-machine-behind",
        "purpose": "The machine holds an ancestor of the applied document: push.",
        "consumers": [
          "mac",
          "desktop",
          "android"
        ],
        "tags": [],
        "input": {
          "local": {
            "hash": "8ff6bb0ca2b4248f2aa643f273d40bb28444bad5d83419e8310a299fb22cf0d6",